flair,title,score,id,url,comms_num,created,body,author,comments,timestamp
Policy & Economy,Why didn't 'Nehruvian Socialism'/'Mixed economy' work?,12,c3cy06,https://www.reddit.com/r/india/comments/c3cy06/why_didnt_nehruvian_socialismmixed_economy_work/,8,1561163959.0,"First of all I would like to say, I have never studied economics and don't understand it very much either. So, if possible ELI5.

All I have seen since I became politically aware a few years ago, is that there are people in America and India fighting about whether Socialism is good or Capitalism is good. Here is what I have gathered so far:

Nehru was influenced by Europe. So, he chose the European model (which is socialism, as I have read) to implement in new India (after independence) in contrast to American model which was capitalistic. It helped start India but India lagged behind other developing nations, progress was 'slow'. Then, in 1990, 'economic liberalization' happened and we became capitalistic. Our economy got a boost. So, as people claim, Nehru's socialism didn't work.

However, European countries are rich and successful nations (that's what I have heard) even though are are 'kinda' socialistic, i.e., a 'Mixed Economy' which combines socialism and capitalism. I have heard from other sources that Nehruvian socialism was actually mixed economy and not hardcore socialism like, say, Soviet Union. I have also heard that under Barack Obama, USA was a mixed economy too. If that's the case, why didn't mixed economy work here? What was the problem?

USA voted for Trump because of capitalistic economic policies. So, I conclude that people of USA were fed up of mixed economic policies. So, did mixed economy fail to work in USA?

Also, a side question: Mixed economy didn't work in early India. Does that mean it still won't work, or ever work in the future?",Suradoe," At the time of Independence we lacked capacity to manufacture capital goods. So there was a consensus at that time that Public Sector will lead the way in producing capital goods. Import substitution was considered as the way forward. 

In 1956 Avadi session of Congress it was decided that we'd adopt socialist model for our economy with private sector competing with public sector. The causes of failure were many:

1) Labor laws were too stringent that it became hard to fire someone even if they were underperforming. That problem still persists

2) Monopolies Restrictive Act (or something like that) kinda prevented firms from growing big

3) Small scale industries couldn't expand either as that would take them out of businesses which were reserved only for small scale industries

4) Public Sector enterprises weren't really efficient because of absence of competition. There was no clarity on what their objective was (whether it's making profits or public service). For example some people used to say how it took them months to get telephone connection those days. 

5) Government was taking over 'sick' companies like Mills which it shouldn't have done in the first place

6) The income tax was prohibitively high on individuals (97 per cent at one point). How can one make money with such rates? That was acting as disincentive. There are several misconceptions in the OP that I shall try to clear before I answer the crux of the question, that is,  why didn't Nehruvian Socialism work. 

Firstly, let's ask ourselves what is socialism. According to Karl Marx, all production takes place due to the combination of labour and capital. This is a relatively standard economic assumption that dates back to Adam Smith and is still used in traditional Economics to this day. Marx's theory postulates that labour is the true source of all production because capital is just dead or crystallised labour. Suppose to produce a chair I need someone to feed wood into a machine. The people we need is labour and the machine that produces the chair is capital. However, this capital was produced by someone else. Some labour was applied to a raw or intermediary good to make it into a machine. If we take this all the way backwards to the first step,  it's clear to see that capital is just labour that has taken place in the past. According to Marx society organises itself around the relations of production, that is society organises itself based on how labour is controlled in societies. All societies pass through stages: a slave state where labour is held within people but people could be owned. Thus he who held slaves commanded labour power and thus controlled society. Eventually slavery would be supplanted by feudalism where labour power was attached to land and he who held land controlled society. Feudalism would eventually be supplanted by capitalism where he who holds capital, also known as private property,  has command of labour and thus controls society. According to Marx, eventually the workers would realise that they were the source of productive power and would engage in a revolution to control society themselves. Socialism is therefore any political ideology that seeks to reduce the power of capital in society,  that is,  to alter the capital labour relationship. If your ideology tries to reduce the power of capital in favour of the power of labour, you are a socialist. 

During his time in England, Nehru was inspired by the Fabian Society which founded the London School of Economics and Political Science. The Fabian society believed that it was possible for Socialism to be achieved democratically, by nationalising the ""commanding heights"" or most important sectors of the economy while still allowing the market or capitalism to provide for commercial goods. Thus the Fabian socialists which influenced Clement Attlee's 1945-51 Labour Party rule in the UK and the Congress Party for the entirty of its rule, (indeed to this day), argued that the most important sectors like steel and iron, infrastructure, and power generation should be run by the government while the private sector can compete and provide for things like chairs and tables and jewellery and watches. 

This model also called as Social Democracy is the primary model in Europe. Nehru tried to adapt the model to India. The problem with this model, is that even from a Marxist perspective it runs contrary to how Socialism ought to function. Marx was not against capitalism blindly. In fact, much of Capital praises capitalism for its revolutionary character. It increased the productive capacity ten thousand fold whereas both slave states and Feudalism were slow and static. According to Marx you need capitalism to flourish to increase the productive capacity of society, such that eventually labourers can use the productive capacity to benefit all of society instead of just the holders of capital. Nehru's model placed so many restrictions on businesses and the INC nationalised them suddenly on the fly such that there was no means by which the productive capacity could grow as the private sector saw no point in investing to generate productive capacity. 

This ties into the problems the Soviets faced too from the Brezhnev era onwards. Once the Stalinist police state was abolished there were no incentives for state firms to actually do well and outperform the government set quotas. For much of the 1970s and 80s firms actually worked under capacity because if they outperformed their quota by a significant amount it would lead to an increase in the quota expected with no remunerations or benefits to the manager or worker for doing better than expected. 

Social Democracy is primarily a European phenomenon. The USA does have a mixed economy but from significantly different roots. The American Liberalism movement owes its ideological basis to the British liberal party who were and (even now are) actually bitter rivals of the socialists. It arose from UK PM David Lloyd George's People's Budget, the Beveridge Report and Keynes. This philosophy known as Social Liberalism argues that capitalism is actually great, but private property unregulated doesn't lead to the best possible outcomes, or as US Mass Senator Elizabeth Warren pithily put it, ""markets without rules are little more than theft"". The American and British social liberals argue that capitalism is great, but we need systematic checks on the market, coming from the government to make sure that capitalism works. So while Obama also supports a mixed economy, it's not because like the Labour Party or Nehru they're trying to alter the distribution of the means of production but because they realise that capitalism without a government presiding over it doesn't work. 

Free marketeers argue in favour of a market uninhibited by a massive government. According to them government regulations distort the market and cause capital to be allocated elsewhere than where it is most productive this affects society by reducing the returns from capital and making society grow slower than it ought to.

The problem with this is that it ignores what social Liberalism found out: that you need a government sector to make capitalism work. One of the best examples of this is Lula da Silva's government in Brazil. Lula da Silva led the Brazilian Worker's Party to victory twice during which he adopted social liberal policies. He did not attempt to alter the capital labour distribution in a developing society. Instead, he facilitated business as much as possible while trying to redistribute the returns to the poorest sections of society to make everyone better off. During Lula' s administration, he pulled millions out of poverty while enabling Brazil to grow at the highest rate of sustained economic growth in its entire history. 

This is not to suggest that social liberalism is always better than social democracy. While social liberalism helps business and thus the economy grow rapidly while bringing people out of poverty, it also increases income and wealth inequality. Eventually once society develops its productive capacity sufficiently (like Europe) it ought to embrace social democracy,  which is what Bernie Sanders is trying to do in the United States. 

I realise this is really long winded but hoped it answered your question! As for your side question no economy is purely capitalistic or purely socialistic. What can make mixed economy tick is where public sector spends the money. When you have government pouring money in a sector where private players are dominant (like in Telecom sector) it is bound to fail because private players are nimble and adapt to changes faster. 

On the other hand social sectors like Education, Hospitals, drinking water supply are the responsibility of the government. Where it fails it would allow private players to exploit the people especially the most vulnerable. Government has competing needs to meet for which it has limited sum to spend. Where it decides to spend decides the fate of the nation. I think you are confused with Mixed economy and social economy.

India is a mixed economy, not a social economy, it simply means that there are certain sectors where both private players and government can participate. Whereas under social economies government either directly or directly control most of the sectors.

To be honest, no system is perfect, socialism has failed in the majority of the countries like Cuba it does not encourage individuals to work hard and take risks. Whereas capitalism if done with honesty can lead to development usually it creates greed for more wealth which leads to poverty, corruption, income inequality.

&#x200B;

The post-independence Indian economy was a mixed economy, it had the potential to take the positives from both social and capitalistic economies, but we took the negatives from both.

Most of the state-owned corporations were managed by politically influenced persons who may have lacked the skills/motivation to successfully run Government corporations.

For private players the situation was no better, there were numerous rules and regulations which needed to be followed, License Raj was demotivating the private players, the banking sector which is the backbone of any economy was underdeveloped. It was very tough to start let alone run new businesses.

India's growth prior to 1990's was slower but we need to understand that we were a new nation and perhaps even the opposition were not strong enough to motivate the ruling government to bring in and execute new reforms. Nehru and people from 1930s are product of socialism. Hence everyone favoured so. Obviously evil of capitalism was well known. All the policies decided based on this framework. But during globalization flood gates opened and everyone got taste of profit and exponential growth and suddenly love of other extreme things. UK, US are product of capitalism from 19th century. Those days liberals are pro capitalism. Come to 1950, liberals love socialism. And cycle keeps repeating Whole system of fractured corrupt broken democracy doesn’t work in India . Meritocracy along likes of East Asian nations is the way to go .  Due to Idiot Indian leaders we missed manufacturing bus .",2019-06-22 06:09:19
Finance & Business,"[EDUCATION]How is Indian School of Business & Finance, Delhi?",38,470e0y,https://www.reddit.com/r/india/comments/470e0y/educationhow_is_indian_school_of_business_finance/,138,1456168091.0,"Hey guys, I'm not sure if this is the correct subreddit to ask on, but it relates to India, and I couldn't find a subreddit which was more appropriate. 

So my question is how good is ISBF, Delhi? Apparently, it's affiliated with University of London, with ""academic direction"" from London School of Economics. I'm not too sure about this as this is literally the first time I'm hearing about this institution (pardon my ignorance). I couldn't find much about it on other websites, either. I'm looking at a BBA (or a BSc in Business & Management in ISBF's case) from either Symbiosis, Pune or NMIMS, Mumbai. 

I have the option to go abroad, but I honestly doubt if it's worth spending 80L+ when I could get a similar degree in about 10L. Of course, the knowledge and exposure I'd get would be tremendous and I'd get a better pay as a fresher, but I doubt it's worth the extra $$$.

What do you guys feel? Thanks :D",fiftycabbages," >ISBF delhi 

Lel apne moolchand vala college. This place is small but I have heard many people go there. They sent you in your final year to London which is quite good although many other universities have this program too. 

>symbiosis pune

Get ready to smoke weed everyday. You name the type of weed you want. Like Bhasin or a little kerela gold and they got you covered. If you are planning to live in a hostel get ready to get high. Peer pressure is unbelieveable 

Tip - share munchies, jaldi dost bnege. Academics sucks there. 

>mims mumbai

Lund college hai, ek Chota sa 7th floor hai bas. No fucking campus 

And fees is retardedly high. Students ki gaand maarte hai college mein. It's a strict school. Placements are quite good here though.  NMIMS would be the way to go in my opinion.  If you can go abroad, give it a try. 

Only, beware of the fact that one year master's programme from UK won't be recognised if you return to India.  Unless you are loaded don't go abroad for undergrad. Just not worth it. Study in India and go for Master's later. What's your current age? Acha ji. Well tbh I did my college around ten years ago, things have clearly changed since then. I'll be writing the NPAT for bba too! 


 we might end up being batchmates :P",2016-02-23 00:38:11
Finance & Business,How do I start investing in the stock market here? Can someone with experience help me out?,65,4dfdi7,https://www.reddit.com/r/india/comments/4dfdi7/how_do_i_start_investing_in_the_stock_market_here/,47,1459869271.0," x post from r/indiainvestments :

So I'm 22. Just out of college having studied finance and business, I feel I am ready to start with a small amount, I have a little over a Lakh saved for stocks. My questions are, what is the best method to invest in them personally? ie I want to manage it myself, not a broker or anything. Secondly, I am aware of the Valuation methods such as DDM and Cash FLow Valuation. I can even do a thorough financial Analysis of the company's accounts having a finance background. My dad said a lot of that wont be useful in India as there is a lot of dirty business going on and not a lot of it is done on merit. Guys that have been doing it for a while, it would be great if you could share your stories and help a young guy out.",BatsmenTerminator," Hey dude, I started investing in Jan. I am sharing what I learned in the last few months.

* Read ""One Up on Wall Street"" by Peter Lynch. It will give you a new perspective to look at companies.
* You should start with Nifty 50 companies. Those companies will not die and will force you into a habit to checking financial news and the stocks prices in general.
* Create a portfolio on google finance or moneycontrol of companies you think you will be interested in.
* Read news related to your portfolio companies.
* Use screener.in for stock screening.
* Its better to buy when the stock market is down. Jan-Feb was the perfect time to join for me since every stock was down. So I invested in some blue chip companies all of which are giving me > 10% return. 
* Since the market is still fluctuating look for days when it has gone down to pick up stocks.
* Start slow with 15-20k and look at how things work out.
* Don't pick expensive shares which cost more than 1000 or ones with PE ratio more then 20. Since if you will be able to buy on 10-15 shares so even if the prices go up by 100 the net income will be only 1000 (you will pay brokerage also on this).  Also price change of 100 does not happen so quickly.

The best way to learn is to start investing. Do not be afraid of failures. Take calculated risks on how much you can afford to lose.  DO NOT, I repeat DO NOT invest in individual stocks after analyzing their cash flow you read through their annual reports. 

1- That information is already priced-in. People have priced the stock based on that information. 

2- There are people with better information then you, those who know CFO ( insider trades) , have been given a tour of the factory( analysts) or understand the sector far better than you. Also there are billion dollar companies who have far more advanced models than what your quad core laptop can possibly run. 

In short, you will not be a player with any advantage by analyzing cash flows. 

3- If you want to invest to make money, invest in mutual funds because frankly they exploit insider information to identify better stocks than you will. They know the govt. policy before it is made public. etc. etc. 

If you want to invest to learn, try building a portfolio on one of those finance sites like Yahoo finance etc. etc. In fact it may be better to pick up a mature market like US for that since there will be lot more data available for you to analyze. You don't need real cash for that ! 

My credentials are that I was in investment management business for 1 year. I have sold hedge funds and REIT's. Trust me, trading directly in stocks is dangerous, although in my stupid bravado, I still sometimes do it :( 

 Log on to www.zerodha.com and create an account. They'll ask you for some ID proof etc. and then set you up with a Demat and Trading account. You can then buy Shares, Mutual Funds, Commodities, Futures and Options, and even Currency Futures. They're one of the cheapest brokerages in India. 

I currently trade with them and so far haven't had any complaints.  Is it worth the time it requires keeping tabs on companies and all? Few basics to covers

Decide what you want to become, a broker i.e one who looks at stock prices every single day and worries about the market fluctuation or an investor who wants to own part of a business because of a hope that you may make some money in future and you believe that company would be able to better use your money for the time you have invested in it than you would. 


If you are looking to become a stock broker than i don't have any advice for you  and you can stop reading here i am sure someone else would be better to help but if you want to become an investor then i have somethings that might be of interest. 

Finish up this reading list in that order.

1. [superinvestors of graham-and-doddsville] (http://www8.gsb.columbia.edu/rtfiles/cbs/hermes/Buffett1984.pdf)  file type. PDF will give you basic overview of stock market 

2.  to understand basic economics you can watch this [How The Economic Machine Works by Ray Dalio, CEO of Bridgewater] (https://www.youtube.com/watch?v=PHe0bXAIuk0) although i would recommend reading up macroeconomics and a bit of econometrics if you have the time

3. If you want to understand the basics of money you can use this [understanding money](http://orcamgroup.com/understanding-money/)


4. Read The *intelligent Investor by Benjamin Graham* and *Security analysis by Benjamin Gramham* ( this one is a bit math heavy but you will be okay with class 10th level math).. these are **the books** for value investing 


5. for more reading you can refer [here](https://np.reddit.com/r/SecurityAnalysis/comments/239qj8/updated_reading_list/)  

most important rule of investing in stock market **Never Invest money you can't let go** i.e. as soon as you have invested money after due analysis ... **forget about the money** 

good luck 

p.s. please ignore the typographical error, if any Invest in Funds instead of trading yourself. They are experts getting paid a whole lot of money to make you and the company $$$ and usually know their stuff more than you do.


Never try to time the market. You need a special kind of luck and very very special talent to do that.  From where you sit, I would recommend you investing your time in building up your career. Just buy tax free government bonds. 8% risk free is best for you. > My dad said a lot of that wont be useful in India as there is a lot of dirty business going on and not a lot of it is done on merit.

Your Dad is partly right, lot of smaller companies do play dirty but if you stick to large and mid cap companies and looking at their 10 year financials helps you figure out which is good and which is bad company to invest.

Most people should stick to mutual funds but if you really want to get our hands wet then get a brokerage account from Zerodha or Indiabulls and start learning fundamental analysis.

A shameless plug for our own service [Fundamental Analysis and Stock Valuation Simplified](http://craytheon.com/).

Lot of individual investors as well as financial analysts and brokers are our members.  Start from SIP  You say

>I can even do a thorough financial Analysis of the company's accounts having a finance background.

Then you say

>Thanks for the advice, but I was mainly asking about how can I start the process? That is do I have to create a Demat account and such?

If you want to have a learning experience and lose quite a bit of the money you've saved then sure, go ahead and try picking stocks and timing the market but if you're serious about saving and creating a foundation for future investing and better returns, this is a terrible idea.",2016-04-05 20:44:31
