flair,title,score,id,url,comms_num,created,body,author,comments,timestamp
Sports,The critics try to pull me down but I'm too busy out running them.,1779,cdxr6p,https://pbs.twimg.com/media/D_QTJVdU4AIDJeI.jpg,74,1563316086.0,,OrneryReflection," Thug life LGBTQ edition Sauce: https://twitter.com/forbes_india/status/1149619411952779264

News: [Dutee Chand bags gold at university games, 1st Indian to win 100m at global meet](https://timesofindia.indiatimes.com/sports/more-sports/athletics/dutee-bags-gold-at-univ-games-1st-indian-to-win-100m-at-global-meet/articleshow/70165745.cms) Amazing! Way to go!.
Really hope society just let's people be and the ones who care, also act to make other's life better.
One human at a time [deleted] Is that LGBTQ 'flash' on purpose? And not just critics, people from our own country don’t care. They’ll cry about Dhoni or Kohli even though NZ was the better team but 3 golds don’t matter cause you’re gay. Wow Good for her Wait don't call them critics if they aren't talking about running.... The ones calling you out for your personal choices are simply hate mongers Wow, 3 credits in one cartoon This is the beginning of her fight. Her hormone levels are bing used to disqualify her. India needs to stand with her when that happens. Fuck yes this is the LGBT representation I WANT to see. Do us homos proud mawma. ""People want me to stop?""

""I'll show them."" [https://imgur.com/2EH6PtY](https://imgur.com/2EH6PtY) What was she criticised for? You should put the source too Identity politics is so dumb. Who cares if she is a lesbian? Some clowns are deriding her for it. Let them. This is not some great battle for justice. It is just social media, which is a passtime for bored people. It doesn't count for anything. 

It diminishes an actual accomplishment like winning a fucking gold medal. Instead people are talking about gay shit like it matters. Completely dumb. Funny not one link on her being bashed ... My lazy ass will now have to google How the hell are the two things interconnected? She is wonderful at athletics. Wow! 
She is a lesbian. Her choice.
This is surely not a line spoken by her i guess. Just some mentally dumb news maker or a lgbt activist trying to promote lgbt through her achievements in sports. I really pity on the world. TIL lesbian and gay are interchangeable words.",2019-07-17 03:58:06
Sports,Dutee Chand won the Gold Medal in Women's 100m sprint at the 30th Summer University Games in Naples (Italy) on Tuesday. This is the first time an Indian has won a 100m Gold at this global event! No Indian had qualified for the 100m final in the history of the University Games before this.,2606,cbbabh,https://i.redd.it/5caaklqt9e931.jpg,89,1562757707.0,,RevenantPanda," She’s much shorter than her competitors. Just shows how much the start meant and she held on to the lead! Explosive running! * **GOLD:** Dutee Chand, India - 11.32 Seconds
* **SILVER:** Ajla Del Ponte, Switzerland - 11.33 Seconds
* **BRONZE:** Lisa Kwayie, Germany - 11.39 Seconds

You can watch the video [here](https://www.youtube.com/watch?v=M1ecUsQCu38) She was like a bullet. Amazing sprint. Congrats Dutee! Media : But we will discuss cricket . Congratulations!!

Proud moment for us all! We've been doing pretty well in athletics this past week.  
Nice! Akshay Kumar starring as dutee chand. Being a 100m athlete myself, this makes me so happy. Dutee is just amazing. I wish the government provides her all the support to train abroad. **Image Courtesy:**

Above 3 pictures are taken from [the official Twitter account of Dutee Chand](https://twitter.com/DuteeChand) 

Picture [1](https://twitter.com/DuteeChand/status/1148682310817992704)  [2](https://twitter.com/DuteeChand/status/1148683305975345152)  [3](https://twitter.com/DuteeChand/status/1148678346961641472) Duty nibhai diye I hope her family problems get solved quickly. Cool Keep the Indian flag flying high. Exactly the kind of news i want to be seeing So much diversity in one pic ! Can't explain why this makes me happy  


Edit: PS. Found one reason. She goes on the cover of Cosmopolitan and also delivers a gold from a foreign city. Literally keeping her head in the game. I was thinking to go to her wiki page but Akshay Kumar will anyways make a movie on this in few months and sell desh bhakti . What's the latest on her controversy regarding testosterone levels? Is she one of those affected by the recent rulings regarding Caster Semenya? Proud feeling Proud of India I love the initiative of posting non-cricket news... kudos! Her coach told her, just before the race...


""New rule Dutee... If any of the big ones catch you, they are allowed to eat you... Have fun."" Anushka and virat is important bro.. Lesbians have to learn to run faster to save their lives from trishool fanatics Splitting sports on gender lines creates complexities like this. If any of her competitors were given testosterone in the amounts she naturally produces, during their puberty, they would probably blow her away.  Same issue with Castor from South Africa.

The question becomes, what is the relevance of being a female athlete when gender is fluid. Can we allow a very effeminate man who identifies as a woman to compete in women’s sports?

Recently there was some news about how top World Cup female soccer teams had been dominated by third tier men’s teams. This is another aspect of the absurdity. If women are insulated from competition from males, because males have unfair levels of testosterone, then shouldn’t they also be insulated from other individuals who have high testosterone regardless of those individual’s self declared gender identification?

Edit: look at that photo. Does it feel fair to arbitrarily allow someone with that much testosterone to compete with women who don’t have that advantage? And if we don’t split on testosterone lines, then why even have gendered sports? Doesn't she have XY chromosomes though? Unfair competition. Indian Athletics and any non Cricket sport deserves more publicity in India. But that said, I don't understand why r/India gets so excited about Indians winning in 3rd tier events in which the top athletes sit out. There are at least 10 women in the world under the age of 20 that can beat her time. And if she ran at the NCAA outdoor championships, she wouldn't even make it out of the prelims with her personal best. Her time of 11.24 would be good for 12th best.The university games are not even on the average American college athletes' radar. That's why these type of events get very little media coverage. I'm gay for her. But I'm a man. She is gay dutee chand. lol. what were her parents smoking before deciding on that name?",2019-07-10 16:51:47
Sports,My grandfather (second from left) with Pandit Jawaharlal Nehru in the 60s after winning a Mallakhamb competition,1139,cfw2bn,https://i.redd.it/cjjgyb2jnlb31.jpg,35,1563719016.0,,widefaceviki," Put this on r/estoration. They will restore the picture by adding color and stuff. Make the memory of your grandfather more vivid. You must be proud of your grand dad We do have amazing sports of our own we need modernization of our sports to bring them up front of Indian People for appreciation. Because shows like India's got talent just undermine our home talents. What is the Political angle in this, apart from the existence of Pandit Nehru in the Photograph? Is the presence of a Political figure, enough to consider a post as Political?

Mallakhamb is actually fucking hard as a sport, and kudos to all those who won the numerous competitions and helped keep this display of gymnastic prowess alive till present day. Good ol days Mudi kaka wants to know your location r/OldSchoolCool This is why India lost the world cup
/S r/oldindia Old school cool, baby. What's Mallakhamb? First time hearing about it. Is it like wrestling What is that mallakhamb competition? Fantastic! A real treasure for you! Which place is this?

&#x200B;

Just curious -- do you also practise Mallakhamb? I have two jokes here

1. Wow pandit nehru looking fabulous after winning a mallakhamb competition with that Gandhi topi

2. I am surprised how pandit nehru didnt shove the guys out of himself and the camera Wow thats a rare photo to be seen! Just for curiosity which place is this!",2019-07-21 19:53:36
Sports,Indian Women’s Hockey team returns to India after winning the FIH Women's Series Finals Hiroshima 2019 after defeating host Japan 3-1 in the Final on June 23,4166,c51zq9,https://i.redd.it/6lzcvwnkdf631.jpg,79,1561463555.0,,RevenantPanda," so Chak de India was not just a movie Now why the fuck it isnt shown in tv?? They need better sponsors. They deserve it. The father of one of their key players , Lalremsiami passed away from a heart attack in his hometown just before the semi final was to be played but she decided to stay on and play for her country.

> The team's head coach Sjoerd Marijne had given Lalremsiami the option of taking the next flight back to India, but she made her decision.
> 
> “She told me, 'I want to make my father proud. I want to stay, play and make sure that the team qualifies',” Marijne told DNA from Hiroshima.
> 
> And so a day after losing her father, Lalthansanga Zote, who had encouraged her to pursue her hockey career, the Mizoram girl walked out on the turf on Saturday, even if it meant missing her doting dad's funeral back home in Kolasib in Mizoram. 
> 
https://www.dnaindia.com/sports/report-a-day-after-losing-her-father-lalremsiami-plays-on-2764003 * **June 22, 2019**

Indian Women's Hockey Team secured their place in the *FIH Olympic Qualifiers 2019* after defeating Chile 4-2 in the semi-finals of the *FIH Women's Series Finals* at the Hiroshima Hockey Stadium, Hiroshima (Japan).

* **June 23, 2019**

Indian Women's Hockey Team won the *FIH Women's Series Finals* after defeating the tournament hosts Japan 3-1 at the Hiroshima Hockey Stadium, Hiroshima (Japan). The news i want to hear in the morning Girl Power. Way to go Team India !!! Thank you for making us proud. Jai Hind. Image Courtesy: [ANI Twitter](https://twitter.com/ANI/status/1143318561156284416) Looks like the picture was taken on phone. Shows how much importance is given. You can also enjoy watching this [video](https://twitter.com/TheHockeyIndia/status/1142775258992132096) \- Indian Women’s Hockey Team celebrating the win while dancing to the beats of popular song *Suno Gaur Se Duniya Walo.*

**Source:**  [The Official Twitter Page of Hockey India](https://twitter.com/TheHockeyIndia/status/1142775258992132096) **Match Highlights** 

[India v Japan | Women's FIH Series Finals | Final | Match 20 Highlights](https://www.youtube.com/watch?v=37_7fXsbdNM) Meanwhile Indian Media : Here's what Virat Kohli has to say about the color of the poster shown in the teaser trailer of his wife's upcoming movie. Congratulations girls! Wow! This is just brilliant. Well played girls. Just a few days back I came across this post where the Indian girls rugby team had won in an international competition and now this. Great stuff girls! Keep up this josh. This was big news here. Lots of cheers for the Indian team. I can’t say for sure why this wasn’t popular in India. Glad to see it here on Reddit. After a rugby win, now hockey.... WOW...our Indian sport's gals are fantastic....well done...you make us really proud...and yes, we do have more to sport than cricket... These girls need their share of respect ,grand welcome as well the social status which is given to cricket team even winning a match against Pakistan. I guess hiroshima is bad luck for japan Was this the same team that got funds through keto?   
or was that ice hockey team? Gurls, you made us proud . Congratulations! congratulations ...we are proud of you all The first row of sportswomen look so young. Happy that they have a long future to contribute more for our country. **""Victory belongs to the most persevering""**

Congratulations  Indian Women’s Hockey team :)

A very proud moment for all of us :) Congratulation Girls... Chak De India... That is so inspiring and uber cool. Atta girls Good heavens, they deserve some more limelight. Every sport except cricket should be on FTA channels. India needs all these sports tournament to be on DD sports otherwise people just don't have the means to watch them. So proud of our women Congratulations Team (y) Well Done I bet Indian media would not get TRP with this :/ Congratulations! proud of you Indian hockey team. congratulations Horrid quality picture, they deserve much better! AAAAAAAAAAAH I AM SO HAPPY Many many Congratulations 🎉🎈 congratulations 🎊..  To Indian  women's hockey team. where is coach kabir khan Mohamed shami's hattrick got more coverage than this,which is just really really sad. !RemindMe in 6 hours By how many runs ?",2019-06-25 17:22:35
Sports,"Virat Kohli : Fastest to 20,000 Runs in International Cricket",1117,c67aq0,https://i.redd.it/kqeumdnj9x631.jpg,131,1561680105.0,,RevenantPanda," De Villiers Manages To Be In Every Fucking Batting Record. Mr. Run machine Every damn match Kohli plays, he's breaking a record. Hat's off to him doing so well inspite of all the negativity about him. [removed] People who debate Sachin Vs Kohli say Kohli did this because he had easier pitches, easier bowlers (which is arguably false) bla blaa.. should also remember that these international innings include T20's for Kohli not for Sachin. In T20's it isn't easy to score many runs since you have 20 overs to bat. Kohli>Sachin tho I whole heartedly agree sachin is a legend. **Image Courtesy:**  [sompaisoscatalans.cat](http://www.sompaisoscatalans.cat/slist/virat-kohli-hd-wallpaper-download/) |  [image address](http://www.sompaisoscatalans.cat/simage/109/1099653/virat-kohli-hd-wallpaper-download.jpg)

&#x200B;

**Edit**

@MODS Team: Only raw image is taken from above mentioned source & remaining addition (design & stats) is done by me. Kindly let me know if you want me to give/mention the **Stats Source** also. No one can come close to Kallis. What a player he was, best ever. Ben Stokes must be feeling very proud. Kallis was OP man. He even used to open bowling for South Africa at one point He will be fastest to 30,000 runs as well. The ease with which he makes run, is amazing. I’d legit suck him off Kohli is amazingly consistent. Looks like we could win the world cup again [removed] Yeah, maybe he is good. But you know something? This man does not represent me. He is way too arrogant. Very boastful. His success is his alone and not mine.   


For some reason, I don't cheer for India anymore. I used to love cricket so much. Sachin, Dravid, Ganguly, Kumble were my heros.  


This would be the first world cup, where I'm not cheering for India (or anyone) and I'm not happy about it.",2019-06-28 05:31:45
Sports,Congratulations to the Indian Women's Rugby Team who have scripted history by registering their First-Ever International 15s Victory by beating Singapore in the Asia Rugby Women's Championship Division 1,2947,c3tylt,https://i.redd.it/qojut7klpy531.jpg,63,1561261769.0,,RevenantPanda," We have a Rugby team. Cool. Congrats girls! This is awesome!

It must've been quite a journey for these athletes to compete in an almost unheard of sport (in this country)

I'm glad to see so many more sports come into the limelight in the recent years. Kabadi and football come to mind. Wow! Never knew this sport was played and practised in India. That too at such a high level.

Must have been some struggle for these girls to reach that stage. Hope stuff like this gets more coverage and support in the future.

Congratulations! You girls are the real deal. The fact that some of us didn't even know we had a rugby team shows how unsupportive India is in sports except for cricket. Our gold medal athletes struggle to live while other countries treat them like any other celebrity Strange to see it's a French Bank sponsoring them. Why can't some Indian firms try to sponsor them too. Really proud of their win We even have Rugby🏉 team... Woo...😯 Congratulations! You all are awesome! As a NZ Indian, this warms my heart. Growing up in a semi rural town, rugby and cricket were the most popular sports by far. Love this! And yes, I played rugby in primary school and also intermediate. I was about to comment ""woah we have a rugby team ?"" But most of the comments are same because all we care about cricket and 2 3 other major games and such games are very underrated even govt does not gives shit about any other games besides 3-4 games. We are mentally breaking the these players atleast we have to cheer about them too.
Congrats. Proud of u ladies. Congratulations 🎊 Awesome stuff!!! There is an Indian WOMEN’s rugby team  😳 Heartily congratulations girls. We are proud of you. **Epic Gamer Moment #19** Congratulations Fuck yeah Fuck yeahhh Love to see more countries playing Rugby, Congrats! Image source: https://twitter.com/RugbyIndia/status/1142383368652279808 Yeh meetup kab hua? Well done Team Rugby.... y'all make us proud...
A huge sporting challenge and a beaurucratic one for sure.... swimming against the tide and y'all came out on top.. 
 There's more to sport than cricket !!  Congratulations! Great news... another sport to look into. We leads in cricket and hockey and now I'm Rugby. Hope that continues.

And BTW the growth of Indian football should lead Indian team into world cup. We should defund cricket, its not even an Olympic sport. Those parasites just each butter chicken everyday. We should help support the people actually bringing glory to our nation. Indian women team in rugby as well .. that's just awesome! More power to women !! Interesting part is - now Indian team is playing various games other than cricket & winning them too! Nice *Indian Rugby Team I know cricket is played like crazy in India but I do hope baseball finds it's way in the country.

If people knew the rules , people would love playing that kick ass game too. Win in 5 s. [removed] Who?",2019-06-23 09:19:29
Sports,I guess this is why Jadhav is still in the team. [Humor],501,c7oj5t,https://v.redd.it/qusjyy83mm731,62,1561987056.0,,Famateur," He is there for underarm bowling Well, someone had to take Jadeja’s job, right? I guess Jadhav is feeding dot balls to dhoni 😛 Honestly, I was pissed off seeing the way these two batted. Reminded me of ""Manoj Prabhakar and Nayan Mongia"" in the mid 90's when they batted in similar fashion without showing any intent towards approaching the target. Back then BCCI had banned both the players for few matches. Jadeja is better at breaking partnership and can score runs.Definitely better candidate than jadhav or vijay shankar Jadhav out DK in the next match plz Team ka hissa hone ke liye, team me hona jaroori nahi WTF was that? Feeding off each other Mahi bhai naa.. Guru ke samaan hai 😂😂😂 Here we see two cricketers practicing their ability to share dot balls I'm a kid who grew up in 90s and the last match was nostalgic as fuck for me. Joginder sharma, Badrinath under Dhoni. Agarkar, Kaif, Shukla under Ganguly. Captains with their favoritism. Feed more. and why is dhoni in the team disgrace to the nation r/Cricket [deleted]",2019-07-01 18:47:36
Sports,[Meme] What watching World Cup ad breaks feels like,553,c67wkf,https://i.redd.it/c4wxdn7cix631.png,69,1561683086.0,,Bang-Ended_Scoot," Dude 1: I dont wanna invest in mutual funds as I don't wanna lose money

Dude 2: Just invest an amount you are comfortable to lose lol

Dude 1:.... holy shit Fog chal raha hai (cringe) Havells: Paani se panga mat lo

Dhoni: LE PANGA [deleted] Zubaan Canceriyaan... *""Par konsa mutual fund sahi hai jaanne ke lie rankmf.com""* Disney's Byjus Early Learn App for classes 1 to 3. Byjus for classes 4 to 12. Looks like y'all have forgotten the Kamla Pasand anthem which is super annoying and pops up all the time. Car bechni ho to Cars24! Acho car Insurance.... Sweetheart meri baat to suno. protip - watch hotstar on your most uncommon device, like a large tab or even a desktop if you have one. far fewer ads! Apparently they are selling ads and allowing advertisers to choose which devices they want ads to appear on and the advertisers just choose the ones with the most RoI, which according to them are ""Android devices with 4"" to 7"" screen sizes"".

My dad and I both watch matches on two devices and while I always get ads, his screen is 90% showing the ground from a wide angle with commentary going on between overs! Where is Kamla pasand. Phir ek bar... That jingle Jio helps they broadcast match on Star Sports Select HD it has dugout stream with no ads. What about that Ranbir Kapoor×Paresh Rawal×Coca Cola threesome wali ad? Dream 11 ads are super cringe as well Virat Kohli: Iss bar fans he jetengey Airtel's Anna Kendrick Cups parody song is right up there Me and my friends work in a same bar. *♫♫ kala cachmaa ♫♫*
Alexa, dim the lights. That trivago guy is my school senior 😂. I'm watching it on Hotstar outside India. Our ads are different, but oh so much less annoying and for far less duration. Ads between every over literally put me off watching the sport :-/ Amidst all these shitty WhatsApp forwards, I finally stumble upon this [OC]. Nice. amazon se paise bhejo sirf upi se What happened to those ""Crown cricket ka madam ji..."" ads? Did that last Pak-Afg-India ad piss somebody off?",2019-06-28 06:21:26
Sports,"Winning 100 Olympic medals by 2032 could be a possibility, Rajyavardhan Singh Rathore said in the Lok Sabha.",48,cf56rl,https://www.deccanherald.com/sports/india-has-potential-to-win-100-olympic-medals-by-2032-747750.html,30,1563555500.0,,abhijaygadai," Chinese government spends $46 billion on sports, while our budget allocation in sports is around $0.5 billion. This rathore guy.. had such high expectations from him but he’s just active on Twitter mostly and does nothing concrete Winning 200 Olympic medals by 2032 is also a possibility! only little problem is that a large number of national sports federations are headed by BJP politicians Did he give any concrete plan? Or are we no longer doing those in India? Yeah, and Sitaraman probably thinks we'll be $20 trillion economy by 2032. Ministers are also Phenku. I can say these numbers are legit. Election won,  now goal post shifted away from 2022 slowly.  देखते रहिए,  जाइयेगा नही Let see how our government welcomes, treats or receives Hima Das. Not impossible. India is projected to become an upper-middle income country by 2025-26. Olympics medal tally is directly proportional to per capita income and population size. Why do we care so much about the Olympics? What about the world championships of the resepective sports.",2019-07-19 22:28:20
