flair,title,score,id,url,comms_num,created,body,author,comments,timestamp
Reddiquette,[Reddiquette] How to apply for Voluntary Euthanasia?,2,89dbn8,https://www.reddit.com/r/india/comments/89dbn8/reddiquette_how_to_apply_for_voluntary_euthanasia/,2,1522788144.0,"Does a person need to file a case in district court for voluntary euthanasia? Or her/his psychiatrist will carry out the euthanasia process?

Will it be possible for someone who is not in hospital, but is diagnosed by her/his psychiatrist to be having multiple mental diseases and the patient is suffering too much to survive, let alone live?",Jakaldhdjdidhah," There's only concept of passive euthanasia in India and I think that was legalised recently. Individual cases will be reffered case by case by doctors if people apporached court but usually they allow it in rarest of rare cases and at present it takes a lot of time. 

We thought of going that route becusee I couldn't bear to see my mom at end of stage 4 cancer but decided against it. Btw if you need help ,there are many resources available. If you need to talk to someone you can just message me",2018-04-04 02:12:24
Reddiquette,Introducing flair: Casual,49,6jrbhk,https://www.reddit.com/r/india/comments/6jrbhk/introducing_flair_casual/,54,1498580244.0,"Hi,

After a lot of submission removals for flair abuse, we have merged the ''Entertainment'' and ''Non-political'' flairs to ""Casual"" flair. It will help users to keep it a bit simple when choosing the correct flair. Please use the flair 'Casual' for all links and posts that are of a non-political nature, including images, memes, entertainment related posts and others which do not fall under the other categories.

[NP] tag in the title will automatically assign the new ""Casual"" flair as well. If you have any questions please feel free to post.
",doc_two_thirty," ""Casual"" would look bad for issues with serious matter. just saying Hmm... so... a natural-disaster news will automatically become casual? NO MORE FLAIRS! Why not just stop removing submissions for flair abuse for those two flairs? ""Casual"" isn't any kind of tag. A tag is supposed to be specific, not vague/ generic. Think about the utility of such a tag - why would I ever want to filter r/india for ""casual"" tagged posts? I wouldn't know what outcome to expect.   

Come up with better (highly-specific and filtering-relevant) tags please; take suggestions from members.  it also needs an education/exam related flair or something https://i.imgur.com/XI6gzNH.jpg

(From r/India itself. Today's.) 

""Filthy Casual."" ""Casual discrimination."" ""Perhaps she should have dressed up in Casuals instead."" 

See?

I think this new [Casual] flair is a bit problematic, and may seem insensitive and inappropriate in plenty of situations. Needs a more serious re-think, in my opinion.

Creating more problems than its solving, really. 

https://www.reddit.com/r/india/comments/6jrvsf/filthy_casual_causal_discrimination_perhaps_she Can't we have a drama flair for posts where drama is the norm regardless of whether it's political or non-political. Eg sachin vs Dravid, missal pav vs  vada pav.

Also a shitpost flair for the aunty buys mangoes type posts. Guys, don't remove Non-Political flair. Let it be there. Use Casual only for really casual posts.  One suggestion: For posts that are not tagged, why not auto tag them to something like 'Casual', rather than deleting them?

Sometimes it becomes difficult to flair, while posting from mobile. Can we have a ""History"" flair? Need another flair - Casual Sax Does anybody use flairs?",2017-06-27 21:47:24
Reddiquette,[Np] Reddiquette. You Should Know : The largest combined arms operation after WW2 that resulted in the largest number of prisoners gained after WW2. India's brilliant victory in the 1971 war.,162,2dbsis,https://www.reddit.com/r/india/comments/2dbsis/np_reddiquette_you_should_know_the_largest/,107,1407872937.0,"The Indian victory against Pakistan in 1971 was one of the greatest examples of operational art and the largest combined arms operation after World War 2. It was a masterpiece of Political objective, Strategic vision, operational planning and tactical execution.


It is important to understand why it was seen as such a great victory. Warfare is usually divided into Positional attrition warfare (think World War 1, Iran-Iraq war or even the India-China war / India-Pakistan war of 1965) or maneuver driven situational warfare. The concept of maneuver warfare was propounded (at around the same time) by various European warfare experts, B.H.Liddel Hart (England) and Mikail Tucahavesky (shot dead by Stalin, and one of THE finest military minds the world has ever seen) was it’s greatest exponent. His theory was, 


Attack on a broad front > use air superiority and arty to make holes in the enemy line > Use this penetration to feed in highly mobile troops who would use maneuver to keep the enemy off balance. The Positional warfare suggests that you can win a war only by crushing the enemies main point of defense (mostly frontally – the British were a firm believer in this theory) while indirect / maneuver warfare suggests that you avoid the strong points, and hit the vulnerable rear of the enemy, keep him off balance, deny him his CCI structure and win the war by using terrain and encirclement (read up on Cannae or Kharkov / Smolensk for examples of encirclement warfare) .


India which had favoured the first theory in all it’s wars till then used the second theory to great effect.


**The Planning:**


In March 1971, Indira Gandhi came back to power with a resounding mandate, and was faced with an immediate crisis! The Bangladeshi refugee problem. A genocide in East Pakistan (estimated deaths vary from 3 million to 4 million) was pushing a massive amount of refugees into India. Her cabinet (especially Defence minister Jagjivan Ram) favoured immediate invasion to settle this crisis and to discuss this, she summoned the CoAS – Sam ‘Bahadur’ Manekshaw. In a very interesting and stormy meeting, she told him to prepare for an invasion of East Pakistan.  Sam Bahadur point blank refused to entertain this and offered to resign straight away. Indira who was used to getting her way, did not like this resistance but asked her advisors to leave the room and had Manekshaw speak his mind freely. He laid down three reasons why he preferred an invasion in the closing months of the year. In this he was going against both Jagjivan Ram and Indira Gandhi  and he was aware of this, but he refused to be a party to a botched up invasion.


•	The Passes with China would be closed because of snow, making it difficult for the Chinese to intervene. In June (when Indira was asking him to invade) the passes would be clear and would need a diversion of efforts to defend these.

•	Monsoon (in this he was proven very right) and the resulting quagmire. The Russian word for it was called “Raptistuta” and means a sea of mud! Mud is the worst enemy for movement (even hard snow can be managed) as it stalls movement to a very low speed. Monsoon would also mean rivers would be in spate so bridging & fording them would be eminently more challenging. August that year saw the worst tropical storm on record till date. It inundated whole parts of Bangladesh and killed half a million Bangladeshi’s.

•	The last was building up a strong and valid cassus belli (cause for war). If India was seen as the aggressor, sanctions would cripple an already crippled economy. It needed to make a case for itself. In the mean time it could use the Bangladeshi govt in exile (based in Calcutta) and the newly created Mutki Bahini to drum up support for itself.

Indira Gandhi agreed to his conditions and set about on a whirlwind tour of diplomacy. She went to Moscow, US, UK & France. She told the governments there that the situation was untenable, but Pakistan was a strong member of the SEATO and CENTO so the western democracies (in a blatant case of hypocrisy) stood by idly while a massive genocide was being perpetrated. Only the USSR recognized the problem, and shipped arms & ammunitions to India to build up her stockpile. India also signed a 20 year treaty of friendship and mutual assistance (this was to prevent any actions by the NATO / US / China)


Mankeshaw then went to work. He created a JIC (IB+RAW+Military intelligence) and a Joint Planning Command (India did not and still does not have a Combined Chief of Staffs like other nations do) to bring the civilians, army, navy and airforce together in the planning. Overall command was given to Lt Gen J.S.Arora who was CiC of the Eastern Command.


**Order Of Battle**


The OOB was as follows, Eastern Command > 3 Army Corps (2nd, 33rd and 4th) > 5 Infantry divisions + 2 Mountain that were on defensive mode. Attached to the infantry divs we had the equivalent of 1 armored division (broken up into regiments). 
Pakistan had roughly 3 Infantry divs and 2 divisions worth of paramilitary and a brigade of armour.


The odds were roughly 2:1 favouring India (conventionally 4:1 was recommended, 3:1 was the bare minimum). In the air India had total supremacy in the east(which was vital) and marginal superiority in the west.


The Mukti Bahini had roughly 60,000 numbers of irregulars. They played the exact same role the French partisans played in WW2 after Normandy. During the war, the Mukti Bahini contributed to the speed of advance of the Indians by providing ready labor and intelligence on the deployment of Pakistani forces. The MB sabotaged Pakistani lines of communication, they struck at weak points (in the rear) with brigade sized forces and caused the Pakistani defence to spread itself thin.


**The Indian Plan**

It was multi layered in it’s approach. Attack in depth to force the Pakistanis to thin themselves out, Cutoff river crossings (to prevent reinforcements and retreat from reaching the Pakistani troops) and finally capture the two key ports in Bangladesh. 

There was one major element of genius provided by J.S.Arora. He changed the Schwerpunkt from the logical south to the more difficult east. The South had it’s base in Bengal, had access to major railway lines and depots and Lt Gen Niazi (Pakistani commander) anticipated the main focus (Schwerpunkt) to be in this sector and aligned his defences accordingly. The East had everything going against it. The main base was inn Tripura, supply / logistics chains had immense difficulties but it was also the closest route to Dhaka. 

J.S Arora allocated the strongest force to the East and the weakest force to the South (the exact opposite of the Pakistani defensive alignment). This has it’s roots in classical warfare including WW2 and the battle of Cannae (which was positional warfare for it’s time). Operation Barbarossa focused it’s Schwerpunkt in the Centre and North while Stavka (Soviet high command aka Stalin) anticipated the key thrust in the South. The German approach to indirect warfare surprised the Russians and caused them a massive loss in men, space and equipment.


**The Pakistani Plan**

Counter offensive in the West and a tiered defense in the East using river lines and cities as strong points (very similar in concept to the Russian defense in WW2 – use river lines and force attritional warfare on the invader. Retreat to city holdfasts and engage troops in urban warfare. Hold out and delay the offensive till such time the UN forced a cease fire (like it had done in the Israeli wars). 

In Bangladesh, Niazi proposed retreating to just outside Dhaka and holding a region around Dhaka (using river lines and Dhaka as a central pivot). The Pakistani establishment rejected this. Once again we have parallels in World War 2. Poland had the option to withdraw it’s forces to the Vistula line, use Warsaw as a pivot and defend a limited area, both these sound ideas were rejected because…”Nationalism”! Not one inch of land would be surrendered etc etc. Niazi went for (as the Indian side had hoped) the WW2 Russian strategy of defending some fortified towns (or as Hitler called them – Festungs) and river lines (bridges). 

The idea was to cut down on the Indian freedom of movement by forcing them to engage in urban warfare. They did make a fatal flaw in their planning. They assumed that India would fight 10 different “Stalingrads”, and never reach Dhaka so they never allocated troops to defend Dhaka (the same mistake Hitler made in WW2 with respect to the defence of Berlin)


**The War**

•	3rd December, Operation Chingis goes in. Pakistan launches a preemptive strike on Indian airfields (in the West). The IAF fights a holding campaign before launching a massive bombardment operation the next morning. In the East, elements of 33 Corps go into action, their objective is to take a vital railway junction. Hilli however was one of the first echelons of Pakistan’s defenses and was very well prepared and supplied. The battle quickly became a battle of attritional warfare, however 340 Brigade spotted an opening in the flank and in a very German Blitzkrieg type of operation, formed combat groups (on the spot) of tanks and infantry and exploited the gap, and these combat groups raced to the river lines that Pakistan had intended to use as defensive strongpoints. Faced with Indians in the rear and forward of them, the resistance quickly collapsed.


•	In the South, using maneuver warfare (as against to positional warfare used by 33 Corp) 2 Corps makes rapid progress, 2 Corps launches a pincer attack using two infantry divisions to envelop Pakistani defences. They keep pushing on towards their target without giving the defenders time to rest and redraw their defensive lines. 2 Corps used the classic maneuver tactics used by Germany in WW2, Israel in the Sinai. They ignored strong points while rushing the rear of the enemy lines (the OMG of Russian doctrine came into play). The infantry pushed on into Pakistani frontline positions who attempted to withdraw to prepared lines only to find them occupied by Indian troops. Defense spectacularly collapsed in this sector. 

•	In the East, 4 Corps (the largest Indian grouping with 3 divisions) and a bold leader pretty much repeated what 2 Corps did. The CO (Lt Gen Sagat Singh) used the Russian concept of Maskirovka and set up a feint attack towards Chittagong, this drew Pakistani defenders (already facing 3:1 odds) to Chittagong weakening their centre. Here we come across a massive feat of arms – Airlifting of 2 entire combat equipped brigades. Rather than contest the Meghna river bridges, Singh sidestepped the exceedingly strong Pakistani defences by getting 2 brigades airlifted and dropped across the river (right into Pakistani lines). The eastern sector was decided as the Schwerpunkt (the focus point of the offensive) and it showed. The Indian troops rapidly outflanked prepared Pakistani positions, artillery was used to bombard these pockets into submission, the IAF flew CAS (Combat Air Support) / Interdiction missions all of which freed the infantry and armour to keep moving. This was classic Blitzkrieg minus only the Stuka sirens. 


The Pakistani forces were in headlong retreat towards Dhaka and this posed a big problem. If they gained the Dhaka region, they could organize a very stubborn defense which would cost 1000’s of Indian lives to capture. To prevent this, 2 Para was dropped BEHIND enemy lines into the region of Tangail. They were very less in number, and if the Pakistanis had grouped up and attempted to fight their way through, 4 Para could have been decimated, but thanks to the Indian Blitzkrieg tactic, the Pakistani C&C set up was decimated and they could not mount a cohesive response. After the drop, the demoralization (and destruction) of organized resistance was complete.


**Psycops**


The Pakistani resistance still numbered in the 1,00,000 and pockets could take a lot of Indian lives to break, so India went on a pysop campaign. Pakistani wirless networks were spammed with “surrender and live” messages (India had cracked the cipher used in East Pakistan before the war itself), Sam Bahadur himself went on air and told Pakistanis that if they surrendered they would be treated honourably, and this cracked any vestige of resistance. Pakistani soldiers began surrendering to the Indian army in droves. Niazi signed the instrument of surrender (a bitter man) on 16th December and went into captivity, along with him 91,000 Pakistani troops also went into captivity.

**Sources**

* Maj Gen D.K Palit's Lightning Campaign. His War in the High Himalayas is also a very interesting book.
* The Liberation by Subramaniam 
* Slender was the thread by J.S.Sen
* Memoirs of J.S Arora

 ",DaManmohansingh," As mentioned in the other thread it blows my mind that we didnt bargain for more with 91k prisoners.

Also interesting is the fact that several paratrooper companies were tibetan fighters who have gotten 0 recognition historically. 1. [A long form article](http://www.openthemagazine.com/article/nation/playing-at-war) detailing Nixon's actions during the war. He even contemplated dropping Nuclear bomb on India.

2. [How General JFR Jacob bluffed to obtain unconditional surrender from General Niazi](http://forbesindia.com/interview/close-range/lt-general-jfr-jacob-i-had-to-ignore-orders/26542/1). More comprehensive version [here](http://fountainink.in/?p=3094)

3. Lastly, enjoy Bhutto losing his marbles at the UN: www.youtube.com/watch?v=1uWf7bWXcqU Brilliant post. Can you please elucidate and elaborate upon the role of the intelligence agencies(particularly RAW and IB) in the whole affair.

edit: Also, interesting books on IB/RAW operations. >Pakistani wirless networks were spammed with “surrender and live” messages

Even back then, we were spammers.

Great read, though. /r/depthhub Thanks for this awesome post!. I want to know more about Warfare, can you suggest me some books that i can read ? 
  Don't 4get the brilliant operations Trident and Python of the Navy. V crippled the enemy and took no casualties in both operation.  Excellent post! Sam Manekshaw, JFR Jacob, PC Lal... the armed forces were exceptionally well led in that war!

You should start a blog. Reach a wider audience.  Pakistan got spanked in this war, no other way to put it. But aside from the loss of life, I'm glad we lost. Bangladesh should never have been part of Pakistan in the first place, and our leaders were doing them no favors. I don't know how true it is, but a lot of people say that during the war, General Yahya Khan was busy drinking and womanizing.  Thanks for the post. I was really looking forward to read this post once I reach home after work. Why the hell is this stuff not taught in schools. According to our text books we have absolutely no history after gaining independence.

You could have made this post on Independence day. Now you must post another one.  What? No reference to Heinz Guderian in maneuver warfare?! Poda!

But great post though! Interesting read, thanks for this. You should add some sources for further reading.

I read about [Sam Manekshaw](http://en.m.wikipedia.org/wiki/Sam_Manekshaw) yesterday, extraordinary individual with a very decorated history. He even served against imperial Japan in WW2. The Soviet Union was also critical to this victory.  Nixon had sent the 7th Fleet into the Bay of Bengal on day 2 to shut down the Indian offensive via aerial and naval bombardment, but the USSR sent a nuclear sub to tail them, implicitly threatening nuclear war should Nixon do so. Gee thnx OP , not only did you mesmerize me with your narration, you have now I have all these books I want to read !

but seriously, thank you , this was brilliant. I saw a brilliant movie 1971, damn the ending still tears me up. What a brilliant actor Manoj Bajpayee is. http://www.youtube.com/watch?v=NKHd6eZ4TLQ Since a number of people over here are asking for further reads, I would recommend this excellent book - ['The Blood Telegram'](http://www.amazon.com/The-Blood-Telegram-Kissinger-Forgotten/dp/0307700208), less from the Indian perspective, and more of Nixon's phobia towards India, and the resulting policies. I have somewhere read that one of the long term mistakes India made during the war was not capturing Pak/ Kashmir territory when they had the chance (as spoils of war) and instead retreating back to pre war positions, this squandered our effort and gains in the long term Okay I have a mildly irrelevant question: weren't Sam Manekshaw and Cariappa Field Marshals at the same time?  Thank you for this excellent analysis. [A life lived such - Field Marshal Sam Manekshaw](http://www.youtube.com/watch?v=qRmPmm7QeIE) While I knew that the 71 war had created one of the largest number of PoWs, the detailed post really gave a lot of insights about the actions on ground. Thanks! Thanks a lot for this. I am very poor when it comes to history like this. Could you hyper link your sources? That way I can find related stuff on the internet. Thanks again. This is the kind of post I want to see in r/India. I love you guys. You should read Col. [David Glantz](http://www.great-victory1945.ru/glantz_3.htm) books/articles on WW2 conflict between USSR and German/Axis powers.

More recently [air cavalry](http://en.wikipedia.org/wiki/Air_assault) concept from Vietnam War and [Air-Land](http://en.wikipedia.org/wiki/AirLand_Battle) and [Air-Sea](http://en.wikipedia.org/wiki/AirSea_Battle) battle doctrine of US 

Some of your analogies to WW2 Germany and USSR could be more nuanced. While principles of maneuver warfare have been around and employed, there is a sea change between nazi doctrine (which was an amorphous collections of principles, often aiming to create a Kesselschlact (battle cauldron) and identifying the SchwerPunkt (focal point of attack) and Soviet combined arms doctrine. These also evolved over time, example [the first battle of smolensk was a disaster for Soviets, as Stalin insisted that they not retreat](http://en.wikipedia.org/wiki/Battle_of_Smolensk_\(1941\)) 

1971 Also saw one place in the east where the Indian army had a heavy slog of it with a more or less direct assault against a tenacious Pakistani commander who had taken advantage of local terrain (ditches etc)  . Will try to locate the reference from Bharat Rakshak or wiki. 

Pakistan strategy that defence of the east ""lies in the west"" and reliance on foreign support was shattered by the speed and preparedness of the Indian assault in the east, able diplomacy by India, local support by Mukti Bahini, and sufficient counterblow in the west to create a stalemate there. You might want to make more of a point of it.

One very minor mistake in a good post is the reference to Hitler's mistake in not manning the city of Berlin. This is an underappreciation of the situation at the end of the war and the local geography/times. The battle of berlin was conducted at natural fortification just outside and was one of the bloodiest and desperate battles of WW2. 

Also of note - The Burma campaign that turned back the japanese army has been cited as one of the largest defeats of the Japanese army ever. (guadalacanal was comparable, but viewed as less strategic and including japanese navy). The battle of Imphal and Kohima are under-rated, as is the achievement of the Chindits. Truly, this is the forgotten war. Perhaps partly because it was a British Indian army with british commanders, partly because the Japanese were at the end of their supply lines, partly because Bose was on the other side.  

The battle of [Keren](http://en.wikipedia.org/wiki/Battle_of_Keren) (a predecessor of Monte Cassino and Tiger Hill) , and other british indian exploits too warrant mentioning.

Neverthless the 1971 war was extremely notable, for all the reasons you mention and more. Great research but couple of points:

* The Maneckshaw offering to resign thing seems blown out of proportion. No one would seriously suggest attacking rainy flood-prone land in the monsoon. Since time immemorial monsoon has been off season for wars in India.

* All your references are by Indian writers who were actors in the war. ""Major element of genius provided by J.S. Arora"" and written about by J.S. Arora, am I right. Every decision victors make in a war becomes one of genius especially when victors write it. You should read some neutral reports. 

* I believe ""Slender was the Thread"" is about the 47-48 war and does not count here. INDIA IS DA BEST. SO PROUD OF MY CUNTRY.",2014-08-13 01:18:57
