flair,title,score,id,url,comms_num,created,body,author,comments,timestamp
Political,[ASK INDIA] Explain the current Karnataka Political Crisis,67,ce7535,https://www.reddit.com/r/india/comments/ce7535/ask_india_explain_the_current_karnataka_political/,38,1563361252.0,Please explain the current political situation or crisis in Karnataka,naveen_reloaded," Remember in school when some spoilt kid did not get batting he would just take his bat and threaten to go home? He would never really go home because you were his only friends, but that did not stop him from threatening and throwing a tantrum. 

These politicians are just nostalgic about their past. Congress+JDS formed Govt to keep BJP out. BJP was desperate and was trying to make MLAs switch sides.

 They tapped into the MLA base who did not get ministries and got them to resign this time.

So numbers will favour BJP for Govt formation. Current Govt will fall by tomorrow. Mota Bhai is on a shopping spree There is an editorial piece about it in today's The Hindu. Give a read. These MLA's cannot defect to BJP because of the anti defection law, so they are resigning instead, this will eventually give BJP more seats allowing them to form the government. 

This type of horse trading is the worst and no other decent democracy would allow shit like this to happen. What a fucking joke. nothing to explain...it's the best example of worst politicians in India. Sad that we common citizens take elections so seriously to choose these idiots as our leaders.. Some Karnataka MLA's of Congress and JDS are fed up with Kumaraswamy and want to resign. Speaker being INC member decides to initiate disqualification against these MLA's without deciding on their resignations. MLA's who resign can contest bypolls and become ministers those who are disqualified cannot contest bypolls for the current session of the assembly.  So these MLA's want to join BJP and contest from BJP for the bypolls and speaker wants to fear them by disqualification to take back their resignations. Whatever may be the result the Congress and JDS government is in minority and is taking important decisions. [Why has this old video of comedian Jaspal Bhatti resurfaced? Answer: Defecting MLAs](https://scroll.in/video/930593/why-has-this-old-video-of-comedian-jaspal-bhatti-resurfaced-answer-defecting-mlas) This is what is happening

Mota Bhai - *MLA kitne k diye?*

Dealer - *Sahab aapke liye 100 mein 2.*

Mota Bhai - *Nahi, nahi bahut mehenga hain, thoda kam karke do, Hum regular customer hai*

Dealer - *Saab, Sabko peet palna hota hain.*

Mota Bhai -  *Dekho muzhe yeh nook jhook pasand nahi, 12-15 chahiye ek saath, tum sahi daam bolo.*

Dealer -  *12-15 pe aapko wholesale rate milega. 650 total.*


Mota Bhai -  *Yeh, lo 600, Pack karwa do.*

Dealer - *Par sahab ???*


Mota Bhai - *Bola na pack karwa do!*

Dealer - *Arre Bhola, jara kamal waale saabji ke liye 15 MLA pack karwa do. Saab, delivery kis hotel pe karni hain? Private plane ka karcha alag hoga.*",2019-07-17 16:30:52
Political,[Non-Political] This newspaper is 50 year old today,114,cfeur8,https://imgur.com/lfOyub8,13,1563607555.0,,Idonthaveabutthole," ""Bankon ka rashtiyakaran janata ke hit mein"" Few words which is picked

IndiraJi
Murarji
Lunar
Class
Orbit

There is no difference in past and present.  awesome!! Where is this ? Price of newspaper is 14 paise? Luna crash lands on Moon.

Milking that sweet cold war news money. (Luna was Russian set of Moon missions, most failed) thank u for posting this",2019-07-20 12:55:55
Political,Rahul Gandhi resigns as President of Congress,1112,c8lydy,https://www.aninews.in/news/national/general-news/i-am-no-longer-congress-president-affirms-rahul-gandhi20190703143743/,413,1562174603.0,,GA3RU," This just might be the best thing to happen to Congress off late. And to Rahul Gandhi too. About time! No matter one's views, India deserves a strong  opposition. 

I'm not sure who should succeed him, but it should be a non-Gandhi who has done good work in their state and is preferably younger. Someone like Sachin Pilot? Here's the full resignation letter from Rahul Gandhi. 


>It is an honour for me to serve the Congress Party, whose values and ideals have served as the lifeblood of our beautiful nation. I owe the country and my organisation a debt of tremendous gratitude and love.

>As President of the Congress Party, I am responsible for the loss of the 2019 election. Accountability is critical for the future growth of our party. It is for this reason that I have resigned as Congress President.

>Rebuilding the party requires hard decisions and numerous people will have to be made accountable for the failure of 2019. It would be unjust to hold others accountable but ignore my own responsibility as President of the party.

>Many of my colleagues suggested that I nominate the next Congress President. While it is important for someone new to lead our party, it would not be correct for me to select that person. Ours is a party with a profound history and heritage, one of struggle and dignity that I deeply respect. It is woven into the fabric of India and I trust the party will make the best decision regarding who can lead us with courage, love and fidelity.

>Immediately after resigning, I suggested to my colleagues in the Congress Working Committee that the way forward would be to entrust a group of people with the task of beginning the search for a new President. I have empowered them to do so and committed my full support to this process and a smooth transition.

>My fight has never been a simple battle for political power. I have no hatred or anger towards the BJP but every living cell in my body instinctively resists their idea of India. This resistance arises because my being is permeated with an Indian idea that is and has always been in direct conflict with theirs. This is not a new battle; it has been waged on our soil for thousands of years. Where they see differences, I see similarity. Where they see hatred, I see love. What they fear, I embrace.

>This compassionate idea permeates the hearts of millions and millions of my beloved fellow citizens. It is this idea of India that we will now vehemently defend.

>The attack on our country and our cherished Constitution that is taking place is designed to destroy the fabric of our nation. In no way, shape or form am I stepping back from this fight. I am a loyal soldier of the Congress party and a devoted son of India and will continue to serve and protect her till my last breath.


>We fought a strong and dignified election. Our campaign was one of brotherhood, tolerance and respect for all of India’s people, religions and communities. I personally fought the Prime Minister, the RSS and the institutions they have captured with all my being. I fought because I love India. And I fought to defend the ideals India was built upon. At times, stood completely alone and am extremely proud of it. I have learned so much from the spirit and dedication of our workers and party members, men and women who have taught me about love and decency.

>A free and fair election requires the neutrality of a country’s institutions; an election cannot be fair without arbiters – a free press, an independent judiciary, and a transparent election commission that is objective and neutral. Nor can an election be free if one party has a complete monopoly on financial resources.

>We didn’t fight a political party in the 2019 election. Rather, we fought the entire machinery of the Indian state, every institution of which was marshalled against the opposition. It is now crystal clear that our once cherished institutional neutrality no longer exists in India.

>The stated objectives of the RSS, the capture of our country’s institutional structure, is now complete. Our democracy has been fundamentally weakened. There is a real danger that from now on, elections will go from being a determinant of India’s future to a mere ritual.

>This capture of power will result in unimaginable levels of violence and pain for India. Farmers, unemployed youngsters, women, tribals, Dalits and minorities are going to suffer the most. The impact on our economy and nation’s reputation will be devastating. The Prime Minister’s win does not negate the breadth of corruption allegations against him; no amount of money and propaganda can ever hide the light of the truth.

>The Indian nation must unite to reclaim and resuscitate our institutions. The instrument of this resuscitation will be the Congress party.

>To achieve this important task, the Congress Party must radically transform itself. Today the BJP is systematically crushing the voice of the Indian people. It is the duty of the Congress Party to defend these voices. India has never and will never be one voice. It is and always will be a symphony of voices. That is the true essence of Bharat Mata.


>Thank you to the thousands of Indians, both at home and abroad, who have sent me letters and messages of support. I will, of course, continue to fight for the ideals of the Congress Party with all my strength. I am available to the party whenever they require my services, input or advice. To those who support the Congress ideology, especially our dedicated and beloved karyakarta, I have absolute faith in our future and the utmost love for you. It is a habit in India that the powerful cling to power, no one sacrifices power. But we will not defeat our opponents without sacrificing the desire for power and fighting a deeper ideological battle. I was born a Congressman, this party has always been with me and is my life’s blood and forever that way it shall remain.

>Jai Hind. Lol. Party members are actually asking him to stay. ""After ages, I am free!"" Dibs on the seat. Have not been following Indian news much since the elections. Who could the next leader of the INC be? If he had done this before, they could have diluted the dynasty tag, at least in the literal sense. But Modi vs WHO? WHO ? WHO ?....now in Arnab's studio when he asks this question only sound will be ...crickets! Well if a male Gandhi heir resigns from politics it should be an indicator of a grim and dark future. His resignation letter
https://mobile.twitter.com/RahulGandhi/status/1146359704815194112 Tomorrow's news : party workers urge RG to take back his resignation.

This can continue forever. Longest resignation ever, has been going on for 3 months now. He will probably get re-hired once the clueless regional leaders start fighting each other. Shashi Tharoor! I guess we will all just ignore that Rahul setup that Congress data cell that basically fed them a bunch of bogus data and information which led to this poll debacle. The power of marketing and pr can do, to finish off a guy forever. Seems like he is just fed up of politics , good  for him to resign. It will be interesting to see how congress will cope with the loss. BJP's 🌟 campanier is out. No matter what people say i have utmost respect for Rahul Gandhi.....he never used crass words and never spew filth at other people and maintained his dignity throughout but alas that's just not indian politics i hope you best in life ahead. Huge loss to BJP! Time to appoint a puppet and pull the strings from behind without any accountability. Comes After 2months actually when he said he will.  Why So much of tantrum - could have been easily done. Not for long. He will courageously, efficiently and magnanimously return to save the party. He probably wants to take a long vacation before doing the come back. Just read the letter he wrote. The man has made so many valid points. https://www.indiatoday.in/elections/story/here-s-how-sonia-gandhi-replaced-sitaram-kesri-as-congress-president-1391491-2018-11-19

`


>Sonia Gandhi resisted all the pressure from ""the loyalist"" Congressmen to join the party. The Rao government was voted out in 1996. Sonia Gandhi did not campaign in the election. The BJP won 161 seats and the Congress got 140.

>Suddenly in the winters of 1997, Sonia Gandhi announced that she would campaign for the Congress party in Lok Sabha election due for March 1998. Sitaram Kesri was the Congress president at the time.

>The change in leadership equation in the Congress was swift.

>Sonia Gandhi joined the party in December 1997 at its plenary session in then Calcutta. She addressed her first election rally in Tamil Nadu, the state where Rajiv Gandhi was assassinated.

>In January, Sitaram Kesri welcomed the decision by Sonia Gandhi to join the Congress and campaign for the party in an interview with India Today.

>Sitaram Kesri said, [""Sonia has come as a savior.""](https://www.indiatoday.in/magazine/interview/story/19980119-sonia-gandhi-has-come-as-a-saviour-sitaram-kesri-828188-1998-01-19) By that time it was clear that the Congress could only function under Sonia Gandhi. Demands were being made in the Congress party asking Sitaram Kesri to hand over the reins of the party to Sonia Gandhi.

>But Sitaram Kesri, then 82, wanted to hold on for some time. He had some support in the party but the ""rebel camp"" was in majority. The Congress Working Committee passed a resolution on March 14, 1998 asking Sitaram Kesri to step down as party president.

>The transfer of power in the Congress is often termed as the bloodless coup. It was dramatic and executed by the use of force.

>Sitaram Kesri was reportedly locked in a room in the Congress headquarters on the Akbar Road in New Delhi to prevent him from creating obstacles in Sonia Gandhi entering the office of the Congress president.

>With Sitaram Kesri locked, Sonia Gandhi entered the Congress headquarters triumphant with her supporters shouting slogans.` lol. good riddance. honestly. BJP supporters (crying): Amul Baby, please don't leave. How will we win without you? :D

&#x200B;

Seriously, Rahul and Sonia should now quit politics and leave. This is a golden opportunity for Congress to kick nepotism and dynasty politics out. If a proper new President is elected then maybe they can give the party credibility. If they elect a Gandhi-controlled robot, then the party will just sink further. This guy finally realised that politics is not his cup of tea. I don't hate him on a personal level, as he seems to be a nice person, but he is/was an absolute disaster as Congress President. Go and live a peaceful life, away from incessant hatred and bigotry. This is a land of wolves now. Permanent thailand citizen incoming India needs a reddit party. The strongest opposition! This is a perfect chance for a competent non gandhi women leader to lead a major party like congress. However unlikely it might be i think it will change our political sphere for good.

Edit: Downvoted for stating an opinion. Never change reddit. Oh, thank god! :) The greatest news you can hear. Hopefully now they can rebuild, with people who are much more competent than he was. We need a stronger opposition more than ever Finally! r/notmyjob Not GG Rahul Good for him. Thanks for the memories, Rahul. now, we can start focusing on a new face for the opposition. Best thing to happen to Rahul, Congress and also India cause you need a strong opposition. A one sided government isn't good for India. A fresh face will light the fire under BJP's ass and keep them on their toes. Finally He was never committed to it bye-bye congress, vultures are their way. About time, this is excellent news, India needs a strong opposition in the coming term, someone to question the government’s mistakes competently and not just say “CHOWKIDAR CHOR HAI” Great news. You are a nice person , politics didnt suit you... If I were in his place, I’d just get on the dating scene, try meeting to some Italian hotties and live the lake Como life Hoping for an Icelandic citizenship? Rahul stays or Rahul leaves, win-win for BJP. Baba will enjoy Iduki gold now... After being defeated so many times, BJP (or Bhartiya Jana Sangh) party presidents should have resigned. Did they? no, why are they forcing Rahul then?",2019-07-03 22:53:23
Political,Emperors of Extraction: The Mughals did not make India rich. Claims of their welfarism only buttress a political agenda,39,cdargd,https://www.dailyo.in/politics/emperors-of-extraction-rana-safvi-the-mughals-did-not-make-india-rich-claims-of-their-welfarism-only-buttress-a-political-agenda/story/1/31483.html,11,1563180822.0,,banker_boy2," A case may be made that Akbar and Jahangir were cut from a different cloth than the rest of the Mughals. Babar is open about his hatred of India and its people, as well as lust for its gold, in Babarnama. Its for a reason that Pakistan named their cruise missile Babur. I don’t know if Shah Jahan hated India or not, but his monument to his wife sucked so much money that it caused a famine around Agra. The less said about Aurangzeb the better. Akbar, on the other hand, is a fascinating, multi faceted ruler and was respected by many of his enemies.

Europe started its renaissance around the time the Mughal empire started, and they never looked back. The Mughals were happy being stationary and the gap kept widening. They for example rejected technologies like the printing press even when it was brought to them. The fact that we care way more about a done and dusted past (on both sides of the argument) - almost as if it means more than the shambles right now and in the future - shows our priorities. He seems to have a nice big ol chip on his shoulder.. 

&#x200B;

I dont get this obsession with trying to disprove indian history either way.. pro or anti.. Its some sick obsession which onle points out how insecure some sections of the populace are, they only strive to pull down others rather then rise up. Claims that Mughal emperors did the opposite and were evil invaders are also only to buttress a political agenda. The author is a borderline bigot going by his twitter feed. Not anything to add to this argument, but I won't believe the tiniest dollop of what this dimwit Abhijit Iyer-Mitra says.",2019-07-15 14:23:42
